{
  "column": {
    "competition_full_name": "马约翰杯五人制足球赛",
    "competition_short_name": "马杯五人制"
  },
  "preview_date": "2026-04-11",
  "headline": "五人制周六测试前瞻",
  "previews": {
    "材料五人制 vs 车辆五人制": {
      "article_file": "previews/材料五人制vs车辆五人制.md",
      "authors": [
        "测试作者"
      ]
    }
  },
  "matches": [
    {
      "game_id": -1,
      "competition_name": "五人制组",
      "stage": "小组赛",
      "kickoff": "2026-04-11T19:00:00+08:00",
      "venue": "综合体育馆",
      "home": {
        "tournament_team_id": null,
        "name": "材料学院五人制",
        "short_name": "材料五人制",
        "previous_outcomes": [],
        "current_results": []
      },
      "away": {
        "tournament_team_id": null,
        "name": "车辆与运载学院五人制",
        "short_name": "车辆五人制",
        "previous_outcomes": [],
        "current_results": []
      },
      "head_to_head": []
    }
  ]
}
