{
  "column": {
    "competition_full_name": "马约翰杯女子足球赛",
    "competition_short_name": "马杯女足"
  },
  "preview_date": "2026-04-11",
  "headline": "女足周六测试前瞻",
  "previews": {
    "社科-心理女足 vs 经管女足": {
      "article_file": "previews/社科-心理女足vs经管女足.md",
      "authors": [
        "测试作者"
      ]
    }
  },
  "matches": [
    {
      "game_id": -1,
      "competition_name": "女子组",
      "stage": "小组赛",
      "kickoff": "2026-04-11T15:30:00+08:00",
      "venue": "紫荆操场",
      "home": {
        "tournament_team_id": null,
        "name": "社会科学学院-心理与认知科学系女足",
        "short_name": "社科-心理女足",
        "previous_outcomes": [],
        "current_results": []
      },
      "away": {
        "tournament_team_id": null,
        "name": "经济管理学院女足",
        "short_name": "经管女足",
        "previous_outcomes": [],
        "current_results": []
      },
      "head_to_head": []
    }
  ]
}
